{
  "cycle_id": "cycle-0002",
  "gap_id": "google-first-party-integrations-code-contract",
  "iteration": 2,
  "state": "APPROVED_GREAT",
  "builder_context_id": "builder-google-context-0002",
  "baseline": {
    "target_commit": "56337cdd1843855ef07842255da27a5f17cdbb23",
    "claude_commit": "6cf1ea9fe4c2088b2ad3089797f846850fd66164",
    "target_metrics": {
      "production_connectors": 0,
      "google_commands": 0,
      "live_smoke_tests": 0
    },
    "claude_metrics": {
      "google_api_commands": "multiple",
      "live_capable": true
    }
  },
  "hypothesis": "A cohesive, read-only Google integration package with bounded transport, truthful evidence states, canonical seoctl wiring, and adversarial tests can meet or exceed the comparator's code-contract quality while leaving live parity explicitly open until authorized credentials exist.",
  "files_changed": [
    ".env.example",
    "adapters/google_pagespeed_live.py",
    "adapters/registry.py",
    "docs/COMMANDS.md",
    "docs/GOOGLE-INTEGRATIONS.md",
    "evaluation/comparative/progress-google-first-party.json",
    "evaluation/cycles/cycle-0002.json",
    "integrations/__init__.py",
    "integrations/google/__init__.py",
    "integrations/google/client.py",
    "integrations/google/crux.py",
    "integrations/google/ga4.py",
    "integrations/google/gsc.py",
    "integrations/google/sitemaps.py",
    "pyproject.toml",
    "seoctl/__main__.py",
    "seoctl/command-registry.json",
    "seoctl/entrypoint.py",
    "seoctl/google_cli.py",
    "tests/test_google_cli.py",
    "tests/test_google_first_party.py",
    "tests/test_seoctl.py",
    "tests/test_seoctl_docs.py"
  ],
  "tests_added": [
    "tests/test_google_first_party.py",
    "tests/test_google_cli.py"
  ],
  "verification": {
    "tests_passed": true,
    "regressions": [],
    "evidence_refs": [
      "pull-request-8",
      "github-actions-run-29176636724",
      "docs/GOOGLE-INTEGRATIONS.md",
      "evaluation/comparative/progress-google-first-party.json",
      "official-google-contract-verification-2026-07-11"
    ],
    "live_state": "BLOCKED",
    "security_passed": true,
    "documentation_executed": true
  },
  "claude_comparison": {
    "functional": 9.0,
    "accuracy": 9.6,
    "security": 10.0,
    "cost_control": 10.0,
    "documentation": 9.2,
    "verdict": "PARITY"
  },
  "builder_rating": "GREAT",
  "reviewer_verdicts": [
    {
      "review_id": "review-cycle-0002-sm3",
      "reviewer_id": "senior-scrummaster-3",
      "role": "SENIOR_SCRUMMASTER_3",
      "context_id": "review-sm3-20260711-pr8",
      "provider": "OpenAI",
      "model": "GPT-5.6 Thinking",
      "evidence_package_hash": "9057162cff2ea97d6fafb22fc22ff92a488cc87ee8707a8f622e1947c65503da",
      "verdict": "APPROVE_GREAT",
      "strongest_objections": [
        "Live provider proof is unavailable, so every live-smoke parity row must remain GAP_OPEN and the live state must remain BLOCKED.",
        "The first draft omitted required aggregate, current CrUX, URL Inspection canonical naming, and sitemap status commands; closure requires all nine commands in the canonical registry and generated documentation.",
        "Search Console detail rows can omit anonymized data, so visible rows must never be represented as property totals and aggregate evidence must come from a separate dimensionless request.",
        "A green fixture suite alone must not be described as live integration parity or production traffic validation.",
        "Operator value would be overstated if missing credentials produced stack traces or false empty results."
      ],
      "evidence_refs": [
        "pull-request-8",
        "github-actions-run-29176636724",
        "tests/test_google_first_party.py",
        "tests/test_google_cli.py",
        "evaluation/comparative/progress-google-first-party.json"
      ],
      "residual_risks": [
        "Real account permission and quota responses remain unobserved without authorized credentials.",
        "Google contract changes after the documented verification date require revalidation."
      ],
      "required_changes": [],
      "submitted_at": "2026-07-12T02:26:00Z",
      "saw_other_reviewer_verdict": false,
      "is_builder": false
    },
    {
      "review_id": "review-cycle-0002-vpe",
      "reviewer_id": "vp-engineering",
      "role": "VP_ENGINEERING",
      "context_id": "review-vpe-20260711-pr8",
      "provider": "OpenAI",
      "model": "GPT-5.6 Thinking",
      "evidence_package_hash": "9057162cff2ea97d6fafb22fc22ff92a488cc87ee8707a8f622e1947c65503da",
      "verdict": "APPROVE_GREAT",
      "strongest_objections": [
        "OAuth refresh responses were initially not size-bounded; approval requires the token path to enforce the same timeout, host, redirect, JSON, and response-size controls as API traffic.",
        "API keys, access tokens, refresh tokens, and encoded credential variants must never appear in generated URLs, logs, exceptions, or tracked files.",
        "Optional Google capabilities must not introduce a persistent token store, a second retry subsystem, a second URL-safety implementation, or mandatory heavy dependencies.",
        "Sitemap behavior must remain read-only by default, with no submission or deletion side effect hidden behind a status command.",
        "Rollback must require only reverting the phase commit and removing environment credentials, with no schema or data migration."
      ],
      "evidence_refs": [
        "pull-request-8",
        "github-actions-run-29176636724",
        "integrations/google/client.py",
        "integrations/google/sitemaps.py",
        "docs/GOOGLE-INTEGRATIONS.md"
      ],
      "residual_risks": [
        "Live OAuth refresh, provider quotas, and permission failures remain blocked by unavailable credentials.",
        "DNS and outbound-network policy can differ across deployment environments and must be validated during authorized smoke tests."
      ],
      "required_changes": [],
      "submitted_at": "2026-07-12T02:26:30Z",
      "saw_other_reviewer_verdict": false,
      "is_builder": false
    }
  ],
  "lessons": [
    "Search Console property totals require a separate dimensionless request because dimension rows may omit anonymized or lower-volume data.",
    "Missing provider records, missing permissions, rate limits, invalid responses, and missing credentials require distinct truthful states rather than zero or empty success.",
    "OAuth token refresh must use the same bounded host, redirect, timeout, size, JSON, and redaction controls as API requests.",
    "Current CrUX, CrUX History, and LCP subparts are separate evidence products and must not be blended.",
    "Fixture-complete production-capable code may be approved while live-smoke parity remains GAP_OPEN and live_state remains BLOCKED."
  ],
  "next_action": "Submit the green production-capable code contract for normal squash merge while preserving GAP_OPEN live-smoke rows; execute authorized read-only smoke tests when credentials become available.",
  "direct_merge_permitted": false,
  "created_at": "2026-07-12T02:00:00Z",
  "updated_at": "2026-07-12T02:26:30Z"
}
